image_id,source,caption,image_path
667,Fourth National Climate Assessment  Volume I.pdf,"Figure 9.3: Annual tornado activity in the United States over the period 1955–2013. The black squares indicate the
number of days per year with at least one tornado rated (E)F1 or greater, and the black circles and line show the
decadal mean line of such tornado days. The red triangles indicate the number of days per year with more than 30 tor-
nadoes rated (E)F1 or greater, and the red circles and line show the decadal mean of these tornado outbreaks. (Figure
source: redrawn from Brooks et al. 201441).",./images/667.png
670,SRREN_Full_Report-1.pdf,"Figure 2.17 | Cost breakdown for energy crop production costs in the grid cells with the lowest production costs within each region for the SRES A1 scenario (IPCC, 2000) in 2050 
(in USD2000 instead of USD2005)(Hoogwijk et al., 2009; reproduced with permission from Elsevier B.V.). ",./images/670.png
676,2007 The Physical Science Basis.pdf,figure 615 sulphate so4 2 concentrations in greenland bigler et al 2002 red line mieding 2005 blue and antarctic traufetter et al 2004 dash violet ice cores during the last millennium also shown are the estimated anthropogenic sulphur s emissions for the nh stern 2005 dashed black the ice core data have been smoothed with a 10year running median fi lter thereby removing the peaks of major volcanic eruptions the inset illustrates the infl uence of volcanic emissions over the last millennium and shows monthly sulphate data in ppm as measured green with identifi ed volcanic spikes removed black most recent volcanic events were not assigned nor removed and results from the 10year fi lter red bigler et al 2002 the records represent illustrative examples and can be infl uenced by local deposition events,./images/676.png
677,Fourth National Climate Assessment  Volume I.pdf,"Figure 4.2: Global mean temperature anomalies (°F) relative to 1976–2005 for four RCP scenarios, 2.6 (green), 4.5
(yellow), 6.0 (orange), and 8.5 (red). Each line represents an individual simulation from the CMIP5 archive. Every RCP-
based simulation with annual or monthly temperature outputs available was used here. The values shown here were
calculated in 0.5°C increments; since not every simulation reaches the next 0.5°C increment before end of century,
many lines terminate before 2100. (Figure source: adapted from Swain and Hayhoe 201540).",./images/677.png
679,2007 The Physical Science Basis.pdf,"Figure 11.26. Map comparing PDFs of change in temperature (2080 to 2099 compared to 1980 to 1999) from Tebaldi et al. (2004a,b) and Greene et al. (2006) as well as the 
raw model projections (represented by shaded histograms) for the Giorgi and Francisco (2000) regions. Areas under the curves and areas covered by the histograms have been 
scaled to equal unity. The scenario is SRES A1B and the season is NH winter (DJF). Asterisks adjacent to ARC and ANT regions indicate that only the Tebaldi et al. results were 
available. ",./images/679.png
680,WGIII_TAR_full_report.pdf,"Figure 3.12: Development of the primary energy demand per unit of production in the pulp and paper industry (PPI-p) in OECD
countries.",./images/680.png
681,ar4_wg3_full_report-1.pdf,"Figure 3.18: Relationship between the scenario's cumulative carbon dioxide 
emissions (2000-2100) and the stabilization target (stabilization categories I to VI, 
of Table 3.5). ",./images/681.png
688,SR15_Chapter_2_LR.pdf,"Figure 2.5 | Evolution and break down of global anthropogenic CO2 emissions until 2100. The top-left panel shows global net CO2 emissions in Below-1.5degC, 
1.5degC-low-overshoot (OS), and 1.5degC-high-OS pathways, with the four illustrative 1.5degC-consistent pathway archetypes of this chapter highlighted. Ranges at the bottom of the 
top-left panel show the 10th-90th percentile range (thin line) and interquartile range (thick line) of the time that global CO2 emissions reach net zero per pathway class, and for 
all pathways classes combined. The top-right panel provides a schematic legend explaining all CO2 emissions contributions to global CO2 emissions. The bottom row shows how 
various CO2 contributions are deployed and used in the four illustrative pathway archetypes (LED, S1, S2, S5, referred to as P1, P2, P3, and P4 in the Summary for Policymakers) 
used in this chapter (see Section 2.3.1.1). Note that the S5 scenario reports the building and industry sector emissions jointly. Green-blue areas hence show emissions from the 
transport sector and the joint building and industry demand sector, respectively. ",./images/688.png
689,WGI_TAR_full_report.pdf,"Figure 4.8: Mid-tropospheric O3 abundance (ppb) in northern mid-
latitudes (36°N-59°N) for the years 1970 to 1996. Observations
between 630 and 400 hPa are averaged from nine ozone sonde stations
(four in North America, three in Europe, two in Japan), following the
data analysis of Logan et al. (1999). Values are derived from the
residuals of the trend fit with the trend added back to allow for discon-
tinuities in the instruments. Monthly data (points) are shown with a
smoothed 12-month-running mean (line).",./images/689.png
690,WGI_TAR_full_report.pdf,"Figure 9.15: Simple model results: Temperature changes from (a) 1990 to 2030 and from (b) 1990 to 2100 for the six illustrative SRES scenarios
and IS92a. The bottom axis indicates the AOGCM to which the simple model is tuned. For comparison results are also shown for the SAR version
of the simple climate model using SAR forcing with some of the IS92 scenarios (see Kattenberg et al., 1996). IS92a H/M/L refers to the IS92a
scenario with climate sensitivity of 1.5, 2.5 and 4.5degC respectively. Also shown are the IS92e scenario with a sensitivity of 4.5degC and the IS92c
scenario with a sensitivity of 1.5degC.",./images/690.png
692,WGIII_TAR_full_report.pdf,"Figure 2.3: Global CO2 emissions from mitigation scenarios for 550ppmv stabilization (fossil fuel CO2 emissions over the period
1990 to 2100 with the maximum and minimum numbers of the database of scenarios). This figure excludes the post-SRES scenarios
(for legend details see Appendix 2.1).",./images/692.png
693,2007 The Physical Science Basis.pdf,"Figure 8.9. Time-mean observed potential temperature (°C), zonally averaged over all ocean basins (labelled contours) and multi-model mean error in this fi eld, simulated
minus observed (colour-fi lled contours). The observations are from the 2004 World Ocean Atlas compiled by Levitus et al. (2005) for the period 1957 to 1990, and the model
results are for the same period in the 20th-century simulations in the MMD at PCMDI. Results for individual models can be seen in the Supplementary Material, Figure S8.12.",./images/693.png
697,ar4_wg3_full_report-1.pdf,"Figure 3.33: Impact of technology on global carbon emissions in reference and climate mitigation scenarios. 
Note: Global carbon emissions (GtC) in four scenarios developed within the IPCC SRES and TAR (A2, B2 top and bottom of left panel; A1FI and A1B top and bottom 
of right panel). The grey-shaded area indicates the difference in emissions between the original no-climate policy reference scenario compared with a hypothetical 
scenario assuming frozen 1990 energy efficiency and technology, illustrating the impact of technological change incorporated already into the reference scenario. 
Colour-shaded areas show the impact of various additional technology options deployed in imposing a 550 ppmv CO2 stabilization constraint on the respective 
reference scenario, including energy conservation (blue), substitution of high-carbon by low- or zero-carbon technologies (orange), as well as carbon capture and 
sequestration (black). Of particular interest are the two A1 scenarios shown on the right-hand side of the panel that share identical (low) population and (high) 
economic growth assumptions, thus making differences in technology assumptions more directly comparable. ",./images/697.png
698,Gavi-FCE_Mozambique-Country-Report_2017.pdf,Figure 14: Contribution of JA to management of vaccination processes,./images/698.png
700,ar4_wg3_full_report-1.pdf,"Figure 4.28: External costs (€/MWh) of current and more advanced electricity systems associated with emissions from the operation of the power plant and the rest of the
fuel-supply chain (EU, 2005). ‘Rest’ is the external cost related to the fuel cycle (1 € = 1.3 US$ approximately).",./images/700.png
702,IHME_GBD2015_report.pdf,figure 32 dalys per 100000 2015,./images/702.png
706,2007 The Physical Science Basis.pdf,"Figure 8.7. Annual mean east-west component of wind stress zonally averaged 
over the oceans. The observationally constrained estimate is from the years 1980 
to 1999 in the European Centre for Medium Range Weather Forecasts 40-year re-
analysis (ERA40; Uppala et al., 2005), and the model climatologies are calculated for 
the same period in the 20th-century simulations in the MMD at PCMDI. The legend 
identifying individual models appears in Figure 8.4.",./images/706.png
709,"2007 Impact, adaption.pdf","Figure 6.9. Real estate damage costs related to flood levels for the Rio
de la Plata, Argentina (Barros et al., 2006).",./images/709.png
712,SRREN_Full_Report-1.pdf,"Figure 7.13 | Example time series of wind power output scaled to wind power capacity for a single wind turbine, a group of wind power plants, and all wind power plants in Germany 
over a 10-day period in 2006 (Durstewitz et al., 2008)",./images/712.png
714,WGIII_TAR_full_report.pdf,"Figure 2.6: Global CO2 emission reduction from baseline for 550ppmv stabilization scenarios, estimated for each scenario
source as baseline emissions minus emissions in the 550ppmv stabilization scenario (for legend details see Appendix 2.1).",./images/714.png
718,2007 The Physical Science Basis.pdf,"Figure 10.6. Zonal means over land and ocean separately, for annual mean surface warming (a, b) and precipitation (c, d), shown as ratios scaled with the global mean 
warming (a, c) and not scaled (b, d). Multi-model mean results are shown for two scenarios, A2 and Commitment (see Section 10.7), for the period 2080 to 2099 relative to the 
zonal means for 1980 to 1999. Results for individual models can be seen in the Supplementary Material for this chapter.",./images/718.png
720,ABCE_Kenya_finalreport_Jan2015.pdf,"Figure 9 Facility SARA scores for recommended equipment, by platform, 2012",./images/720.png
723,Gavi-FCE_Uganda-Country-Report_2017.pdf,"Figure 16: Percentage of vaccinated children who are immune, by district ",./images/723.png
728,Guatemala_PCE_annual_country_report_2019_English.pdf,Figure 15. Distribution of cost categories for the total malaria grant (2019-2021),./images/728.png
729,Gavi-FCE_Mozambique-Country-Report_2017.pdf,Figure 11: Mobile brigades (MB) planned with (2016) and without (2015) HSS funds,./images/729.png
735,SRREN_Full_Report-1.pdf,"Figure 2.22 | Cost projections for lignocellulosic ethanol and BTL diesel (Energy 
Technology Perspectives 2008, (c) OECD/IEA, Figure 9.11, p. 335 in IEA (2008a); for 
additional future cost considerations see also Sims et al. (2008), IEA Renewable Energy 
Division (2010) and IEA (2011)).",./images/735.png
736,CARBON DIOXIDE CAPTURE AND STORAGE.pdf,"Figure 5.7 Radial simulations of CO2 injection into a homogeneous formation 100 m thick, at a depth of 1 km, where the pressure is 10 MPa and 
the temperature is 40degC. The injection rate is 1 MtCO2 yr-1 for 20 years, the horizontal permeability is 10 -13 m2 (approximately 100 mD) and the 
vertical permeability is one-tenth of that. The residual CO2 saturation is 20%. The first three parts of the figure at 2, 20 and 200 years, show the 
gas saturation in the porous medium; the second three parts of the figure at 200, 2000 and 4000 years, show the mass fraction of dissolved CO2 
in the aqueous phase (after Ennis-King and Paterson, 2003).",./images/736.png
738,Gavi-FCE_Zambia-Country-Report_2017.pdf,Figure 10: Comparison of cMYP required resources and actual EPI expenditure 2012-2015,./images/738.png
739,ar4_wg3_full_report-1.pdf,"Figure 4.11: Investment costs and penetration rates for PV, wind and bioethanol 
systems showing cost reductions of 20% due to technological development and 
learning experience for every doubling of capacity once the technology has matured.",./images/739.png
746,Gavi-FCE_Mozambique-Country-Report_2017.pdf,"Figure 16: Percentage of vaccinated children who are immune, by district ",./images/746.png
751,Uganda_2019_Annual_Country_Report_2019_Final_pdf.pdf,"Figure 7. Positive HIV tests and people newly enrolled on ART, 2015 - 2018 ",./images/751.png
752,Gavi-FCE_Uganda-Country-Report_2017.pdf,"Figure 26: Percentage of vaccinated children who are immune, by district ",./images/752.png
752,Gavi-FCE_Zambia-Country-Report_2017.pdf,"Figure 16: Percentage of vaccinated children who are immune, by district ",./images/752.png
753,SRREN_Full_Report-1.pdf,"Figure 9.13 | Premature deaths from household air pollution and other diseases in 2008 
and projected for 2030 (IEA, 2010a).",./images/753.png
754,2007 The Physical Science Basis.pdf,"Figure 3.4. (a) Annual anomalies of global SST (HadSST2; red bars and blue solid curve), 1850 to 2005, and global NMAT (HadMAT, green curve), 1856 to 2005, relative to 
the 1961 to 1990 mean (degC) from the UK Meteorological Offi ce (UKMO; Rayner et al., 2006). The smooth curves show decadal variations (see Appendix 3.A). The dashed black 
curve shows equivalent smoothed SST anomalies from the TAR. (b) Smoothed annual global SST anomalies, relative to 1961 to 1990 (degC), from HadSST2 (blue line, as in (a)), 
from NCDC (Smith et al., 2005; red line) and from COBE-SST (Ishii et al., 2005; green line). The latter two series begin later in the 19th century than HadSST2. (c,d) As in (a) but 
for the NH and SH showing only the UKMO series.",./images/754.png
757,SRREN_Full_Report-1.pdf,"Figure 7.17 | Estimates of the increase in balancing costs due to wind energy from several wind energy integration studies in Europe and the USA (Holttinen et al., 2009).1",./images/757.png
758,SR15_Chapter_2_LR.pdf,"Figure 2.16 | Electricity generation for the four illustrative pathway archetypes plus the IEA's Faster Transition Scenario (IEA, 2017d) (panel a), and their 
relative location in the ranges for pathways limiting warming to 1.5degC with no or limited overshoot (panel b). The category 'Other renewables' includes electricity 
generation not covered by the other categories, for example, hydro and geothermal. The number of pathways that have higher primary energy than the scale in the bottom panel 
are indicated by the numbers above the whiskers. Black horizontal dashed lines indicate the level of primary energy supply in 2015 (IEA, 2017e). Box plots in the lower panel show 
the minimum-maximum range (whiskers), interquartile range (box), and median (vertical thin black line). Symbols in the lower panel show the four pathway archetypes - S1 (white 
square), S2 (yellow square), S5 (black square), LED (white disc) - as well as the IEA's Faster Transition Scenario (red disc). Pathways with no or limited overshoot included the Below-
1.5degC and 1.5degC-low-OS classes. ",./images/758.png
759,SRREN_Full_Report-1.pdf,"Figure 10.21 | Range of annual global CO2
savings from RE in total for a set of four illustrative scenarios for 2030 and 2050 (Note: biofuels for transport are excluded, and biomass
used for direct heating only accounts for half the CO2
savings due to embedded GHG emissions from bioenergy). (The presented range marks the high uncertainties regarding the
substituted energy source: while the upper limit assumes a full substitution of high-carbon fossil fuels, the lower limit considers specifi c CO2
emissions of the analyzed scenario itself.)
Sources: IEA-WEO2009-Baseline (IEA, 2009; Teske et al., 2010), ReMIND-RECIPE (Luderer et al., 2009), MiniCAM-EMF22 (Calvin et al., 2009), ER-2010 (Teske et al., 2010).",./images/759.png
764,WGI_TAR_full_report.pdf,"Figure 6.9. Projected changes in the number of days per year with a maximum temperature above 90degF and a min-
imum temperature below 32degF in the contiguous United States. Changes are the difference between the average for 
mid-century (2036-2065) and the average for near-present (1976-2005) under the higher scenario (RCP8.5). Maps 
in the top row depict the weighted multimodel mean whereas maps on the bottom row depict the mean of the three 
warmest models (that is, the models with the largest temperature increase). Maps are derived from 32 climate model 
projections that were statistically downscaled using the Localized Constructed Analogs technique.51 Changes are sta-
tistically significant in all areas (that is, more than 50% of the models show a statistically significant change, and more 
than 67% agree on the sign of the change45). (Figure source: CICS-NC and NOAA NCEI).",./images/764.png
765,"2007 Impact, adaption.pdf","Figure 4.1. Major ecosystems addressed in this report, with their
global areal extent (lower panel, Mkm2), transformed by land use in
yellow, untransformed in purple, from Hassan et al. (2005), except for
mediterranean-climate ecosystems, where transformation impact is
from Myers et al. (2000), and total carbon stores (upper panel, PgC) in
plant biomass (green), soil (brown), yedoma/permafrost (light blue). D =
deserts, G&S(tr) = tropical grasslands and savannas, G(te) = temperate
grasslands, ME = mediterranean ecosystems, F(tr) = tropical forests,
F(te) = temperate forests, F(b) = boreal forests, T = tundra, FW =
freshwater lakes and wetlands, C = croplands, O = oceans. Data are
from Sabine et al. (2004, Table 2.2, p. 23), except for carbon content of
yedoma permafrost and permafrost (light blue columns, left and right,
respectively, Zimov et al., 2006), ocean organic carbon content
(dissolved plus particulate organic; Denman et al., 2007, Section
7.3.4.1), and ocean surface area from Hassan et al. (2005, Summary,
Table C2, p. 15, inserted as a number). Figures here update the TAR
(Prentice et al., 2001), especially through considering soil C to 3 m
depth (Jobbagy and Jackson, 2000), as opposed to 1 m. Approximate
carbon content of the atmosphere (PgC) is indicated by the dotted
lines for last glacial maximum (LGM), pre-industrial (P-IND) and current
(about 2000).",./images/765.png
768,ABCE_Uganda_finalreport_Jan2015.pdf,"Figure 9 Facility SARA scores for recommended equipment, by platform, 2012",./images/768.png
770,ABCE_Ghana_finalreport_Jan2015.pdf,"FIGURE 3 Average number of facility personnel, by platform, 2007-2011 ",./images/770.png
771,ar4_wg3_full_report-1.pdf,"Figure 5.5: Total stock of light-duty vehicles by region 
Source: WBCSD, 2004a.",./images/771.png
772,WGI_TAR_full_report.pdf,"Figure 9.21: Simulated water-volume transport change of the Atlantic 'conveyor belt' (Atlantic overturning) in a range of global warming
scenarios computed by different climate research centres. Shown is the annual mean relative to the mean of the years (1961 to 1990) (Unit: SV,
106 m3s-1). The past forcings are only due to greenhouse gases and aerosols. The future-forcing scenario is the IS92a scenario. See Table 9.1 for
more information on the individual models used here.",./images/772.png
773,SYR_AR5_FINAL_full.pdf,"Figure 4.2 | Influence of energy demand on the deployment of energy supply technologies in 2050 in mitigation scenarios reaching about 450 to about 500 ppm CO2-eq con-
centrations by 2100 (at least about as likely as not to limit warming to 2degC above pre-industrial levels). Blue bars for 'low energy demand' show the deployment range of scenarios 
with limited growth in final energy demand of <20% in 2050 compared to 2010. Red bars show the deployment range of technologies in a case of 'high energy demand' (>20% 
growth in 2050 compared to 2010). For each technology, the median, interquartile and full deployment range is displayed. Notes: Scenarios assuming technology restrictions are 
excluded. Ranges include results from many different integrated models. Multiple scenario results from the same model were averaged to avoid sampling biases. {WGIII Figure TS.16}",./images/773.png
779,WGIIAR5-PartA_FINAL.pdf,"Figure 6-5 | Thermal specialization of an organism explains the why, how, when, and where of climate sensitivity. (a) The thermal tolerance range and performance levels of an
organism are described by its performance curve (exemplified for an animal). Each performance (e.g., exercise, growth, reproduction) is maximal at its optimum temperature (Topt
), and becomes progressively constrained during cooling or warming. Surpassing the first low- and high-temperature thresholds (Tp; p, pejus: getting worse) means going into
time-limited tolerance. Once further cooling or warming surpasses the next low or high thresholds (Tc; c, critical), oxygen availability becomes insufficient and an anaerobic
metabolism begins. Denaturation temperatures (Td) are even more extreme and characterized by the onset of damage to cells and proteins. Horizontal arrows indicate that Tp, Tc
,and Td thresholds of an individual can shift, within limits, between summer and winter (seasonal acclimatization) or when the species adapts to a cooler or warmer climate over
generations (evolutionary adaptation). Under elevated CO2 levels (ocean acidification) and in hypoxic waters performance levels can decrease and thermal windows narrow
(dashed gray curves). (b) The width of the thermal range (horizontal arrows) also changes over time when an individual develops from egg to larva to adult and gains weight and
size. Blue to red color gradients illustrate the range between cold and warm temperatures (after Pörtner, 2002a, 2012; Pörtner and Farrell, 2008).",./images/779.png
781,IHME_GBD2015_report.pdf,figure 2 trends in dalys for communicable maternal neonatal and nutritional diseases noncommunicable diseases and injuries 19902015,./images/781.png
782,Gavi-FCE_Mozambique-Country-Report_2017.pdf,Figure 19: Mozambique co-financing obligations,./images/782.png
784,WGI_TAR_full_report.pdf,"Figure 13.4: A schematic representation of different simulations and
periods in a coupled AOGCM climate change experiment that may be
used in the definition of modelled climate change. t1 to t4 define
alternative 30-year periods from either forced or unforced experiments.",./images/784.png
790,SRREN_Full_Report-1.pdf,"Figure 1.21 | Levelized Cost of Fuels (LCOF) for commercially available biomass conver-
sion technologies covering a range of different discount rates. LCOF estimates for all tech-
nologies are based on input data summarized in Annex III and the methodology outlined 
in Annex II. The lower bound of the levelized cost range is based on a 3% discount rate 
applied to the low ends of the ranges of investment, operations and maintenance (O&M) 
and feedstock cost. The higher bound of the levelized cost range is accordingly based 
on a 10% discount rate applied to the high end of the ranges of investment, O&M and 
feedstock costs. Note that conversion effi ciencies, by-product revenue, capacity factors 
and lifetimes were set to average values. HHV stands for 'higher heating value'. For data 
and supplementary information see Annex III.",./images/790.png
796,SR15_Chapter_2_LR.pdf,"Figure 2.15 | Primary energy supply for the four illustrative pathway archetypes plus the IEA's Faster Transition Scenario (OECD/IEA and IRENA, 2017) (panel 
a), and their relative location in the ranges for pathways limiting warming to 1.5degC with no or limited overshoot (panel b). The category 'Other renewables' 
includes primary energy sources not covered by the other categories, for example, hydro and geothermal energy. The number of pathways that have higher primary energy than the 
scale in the bottom panel are indicated by the numbers above the whiskers. Black horizontal dashed lines indicates the level of primary energy supply in 2015 (IEA, 2017e). Box 
plots in the lower panel show the minimum-maximum range (whiskers), interquartile range (box), and median (vertical thin black line). Symbols in the lower panel show the four 
pathway archetypes S1 (white square), S2 (yellow square), S5 (black square), LED (white disc), as well as the IEA-(red disc). Pathways with no or limited overshoot included the 
Below-1.5degC and 1.5degC-low-OS classes. ",./images/796.png
798,IHME_GBD2015_report.pdf,"Figure 5 Death rate observed versus that expected based on SDI level, ages 0–5, global,
1990–2015",./images/798.png
799,WGI_TAR_full_report.pdf,"Figure 4.5: Abundance of SF6 (ppt) measured at Cape Grim, Tasmania
since 1978 (Maiss et al., 1996; Maiss and Brenninkmeijer, 1998).
Cape Grim values are about 3% lower than global averages.",./images/799.png
802,ar4_wg3_full_report-1.pdf,"Figure TS.2a: GHG emissions by sector in 1990 and 2004 100-year GWPs from
IPCC 1996 (Second Assessment Report (SAR)) were used to convert emissions to
CO2-eq. The uncertainty in the graph is quite large for CH4 and N2O (in the order
of 30–50%) and even larger for CO2 from agriculture and forestry. For large-scale
biomass burning, averaged activity data for 1997–2002 were used from Global Fire
Emissions Database based on satellite data. Peat (fire and decay) emissions are
based on recent data from WL/Delft Hydraulics. [Figure 1.3a]",./images/802.png
804,2007 The Physical Science Basis.pdf,"Figure 3.15. Latitude-time section of zonal average annual anomalies for precipitation (%) over land from 1900 to 2005, relative to their 1961 to 1990 means. Values are
smoothed with the 5-point fi lter to remove fl uctuations of less than about six years (see
Appendix 3.A). The colour scale is nonlinear and grey areas indicate missing data.",./images/804.png
