image_id,source,caption,image_path
1932,ar4_wg3_full_report-1.pdf,"Figure 4.24: Recent growth in distributed electricity generation using fossil-fuel 
resources in North America.
Source: EPRI, 2003. ",./images/1932.png
1934,PolicyReport_Namibia_2016.pdf,figure 14 percentage breakdown of total disability ylds by age group both sexes namibia 2013,./images/1934.png
1938,PolicyReport_Namibia_2016.pdf,figure 24 probability of death in namibia and comparison countries males and females 1549 years 2013,./images/1938.png
1943,2007 The Physical Science Basis.pdf,"Figure 7.12. Model projections of the neutralization of anthropogenic CO2 for an 
ocean-only model, a model including dissolution of CaCO3 sediment and a model 
including weathering of silicate rocks, (top) for a total of 1,000 GtC of anthropogenic 
CO2 emissions and (bottom) for a total of 5,000 GtC of anthropogenic CO2. Note that 
the y-axis is different for the two diagrams. Without CaCO3 dissolution from the sea-
fl oor, the buffering of anthropogenic CO2 is limited. Even after 100 kyr, the remaining 
pCO2 is substantially higher than the pre-industrial value. Source: Archer (2005). ",./images/1943.png
1944,2007 The Physical Science Basis.pdf,"Figure 3.21. The radiative signature of upper-tropospheric moistening is given 
by upward linear trends in T2-T12 for 1982 to 2004 (0.1 oC per decade; top) and 
monthly time series of the global-mean (80degN to 80degS) anomalies relative to 1982 to 
2004 (oC) and linear trend (dashed; bottom). Data are from the RSS T2 and HIRS T12 
(Soden et al., 2005). The map is smoothed to spectral truncation T31 resolution.",./images/1944.png
1945,ar4_wg3_full_report-1.pdf,"Figure 7.1: CO2 reduction potential of eight energy saving technologies in 2030
CDQ = Coke Dry Quenching, HS = Hot Stove, TRT = Top Pressure Recovery Turbine, SC = Sinter Cooling, CC = Continuous Casting, SP = Sinter Plant, BOFG = Basic 
Oxygen Furnace Gas, ME = Main Exhaust, WH = Waste Heat",./images/1945.png
1946,2007 The Physical Science Basis.pdf,"Figure 9.4. Contribution of external forcing to several high-variance 
reconstructions of NH temperature anomalies, (Esper et al., 2002; Briffa et al., 2001; 
Hegerl et al., 2007, termed CH-blend and CH-blend long; and Moberg et al., 2005). 
The top panel compares reconstructions to an EBM simulation (equilibrium climate 
sensitivity of 2.5degC) of NH 30degN to 90degN average temperature, forced with volcanic, 
solar and anthropogenic forcing. All timeseries are centered on the 1500-1925 
average. Instrumental temperature data are shown by a green line (centered to 
agree with CH-blend average over the period 1880-1960). The displayed data are 
low-pass fi ltered (20-year cutoff) for clarity. The bottom panel shows the estimated 
contribution of the response to volcanic (blue lines with blue uncertainty shade), solar 
(green) and greenhouse gas (GHG) and aerosol forcing (red line with yellow shades, 
aerosol only in 20th century) to each reconstruction (all timeseries are centered 
over the analysis period). The estimates are based on multiple regression of the 
reconstructions on fi ngerprints for individual forcings. The contributions to different 
reconstructions are indicated by different line styles (Briffa et al.: solid, fat; Esper et 
al.: dotted; Moberg: dashed; CH-blend: solid, thin; with shaded 90% confi dence limits 
around best estimates for each detectable signal). All reconstructions show a highly 
signifi cant volcanic signal, and all but Moberg et al. (which ends in 1925) show a 
detectable greenhouse gas signal at the 5% signifi cance level. The latter shows a 
detectable greenhouse gas signal with less signifi cance. Only Moberg et al. contains 
a detectable solar signal (only shown for these data and CH-blend, where it is not 
detectable). All data are decadally averaged. The reconstructions represent slightly 
different regions and seasons: Esper et al. (2002) is calibrated to 30degN to 90degN land 
temperature, CH-blend and CH-blend long (Hegerl et al., 2007) to 30degN to 90degN 
mean temperature and Moberg et al. (2005) to 0deg to 90degN temperature. From Hegerl 
et al. (2007).",./images/1946.png
1947,2007 The Physical Science Basis.pdf,"Figure 10.18. Changes in extremes based on multi-model simulations from nine global coupled climate models, adapted from Tebaldi et al. (2006). (a) Globally averaged 
changes in precipitation intensity (defi ned as the annual total precipitation divided by the number of wet days) for a low (SRES B1), middle (SRES A1B) and high (SRES A2) 
scenario. (b) Changes in spatial patterns of simulated precipitation intensity between two 20-year means (2080-2099 minus 1980-1999) for the A1B scenario. (c) Globally aver-
aged changes in dry days (defi ned as the annual maximum number of consecutive dry days). (d) Changes in spatial patterns of simulated dry days between two 20-year means 
(2080-2099 minus 1980-1999) for the A1B scenario. Solid lines in (a) and (c) are the 10-year smoothed multi-model ensemble means; the envelope indicates the ensemble 
mean standard deviation. Stippling in (b) and (d) denotes areas where at least fi ve of the nine models concur in determining that the change is statistically signifi cant. Extreme 
indices are calculated only over land following Frich et al. (2002). Each model's time series was centred on its 1980 to 1999 average and normalised (rescaled) by its standard 
deviation computed (after de-trending) over the period 1960 to 2099. The models were then aggregated into an ensemble average, both at the global and at the grid-box level. 
Thus, changes are given in units of standard deviations.",./images/1947.png
1949,2007 The Physical Science Basis.pdf,"Figure 4.5. Time series of freeze-up and breakup dates from several northern lakes and rivers (reprinted with permission from Magnuson et al., 2000, copyright AAAS). Dates 
have been smoothed with a 10-year moving average. See the cited publication for locations and other details. ",./images/1949.png
1951,SRREN_Full_Report-1.pdf,"Figure 8.4 | Share of total heat demand in buildings supplied by district heating schemes 
for selected countries (Euroheat&Power, 2007).",./images/1951.png
1953,WGI_TAR_full_report.pdf,"Figure 8.4: Second-order statistics of surface air temperature, sea level
pressure and precipitation simulated by CMIP2 model control runs.
The radial co-ordinate gives the magnitude of total standard deviation,
normalised by the observed value, and the angular co-ordinate gives
the correlation with observations. It follows that the distance between
the OBSERVED point and any model's point is proportional to the
r.m.s model error (see Section 8.2). Numbers indicate models counting
from left to right in the following two figures. Letters indicate alternate
observationally based data sets compared with the baseline observa-
tions: e = 15-year ECMWF reanalysis ('ERA'); n = NCAR/NCEP
reanalysis. From Covey et al. (2000b).",./images/1953.png
1954,WGI_TAR_full_report.pdf,"Figure 10.15: Difference between 2(cid:2)CO2 and control run surface air
temperature as a function of elevation over the Alpine sub-region for
the four seasons. Units are degC. From Giorgi et al. (1997).",./images/1954.png
1954,WGI_TAR_full_report.pdf,"Figure 10.15: Difference between 2CO2 and control run surface air
temperature as a function of elevation over the Alpine sub-region for
the four seasons. Units are °C. From Giorgi et al. (1997).",./images/1954.png
1955,CARBON DIOXIDE CAPTURE AND STORAGE.pdf,"Figure 8.7 Deployment of CCS systems as a function of time from 
1990 to 2100 in the IPCC TAR mitigation scenarios where atmospheric 
CO2 concentrations stabilize at between 450 to 750 ppmv. Coloured 
thick lines show the minimum and maximum contribution of CCS for 
each SRES scenario group, and thin lines depict the contributions in 
individual scenarios. Vertical axes on the right-hand side illustrate the 
range of CCS deployment across the stabilization levels for each SRES 
scenario group in the year 2100.",./images/1955.png
1960,IHME_GBD2015_report.pdf,figure 22 ylls and ylds by sdi quintile 19902015,./images/1960.png
1963,WGI_TAR_full_report.pdf,"Figure 4.9: (left panel) Observed versus modelled (1) HO2 abundance (ppt), (2) OH abundance (ppt), and (3) HO2/OH ratio in the upper
troposphere (8 to 12 km altitude) during SONEX. Observations are for cloud-free, daytime conditions. Model calculations are constrained with
local observations of the photochemical background (H2O2, CH3OOH, NO, O3, H2O, CO, CH4, ethane, propane, acetone, temperature, pressure,
aerosol surface area and actinic flux). The 1:1 line (solid) and instrumental accuracy range (dashed) are shown. Adapted from Brune et al. (1999). 
(right panel) Observed (4) HO2 abundance (ppt), (5) OH abundance (ppt), and (6) derived O3 production rate (ppb/day) as a function of the NOx
(NO+NO2) abundance (ppt). Data taken from SONEX (8 to 12 km altitude, 40deg to 60degN latitude) and adapted from Jaegle et al. (1999). All values
are 24-hour averages. The lines correspond to model-calculated values as a function of NOx using the median photochemical background during
SONEX rather than the instantaneous values (points).",./images/1963.png
1964,2007 The Physical Science Basis.pdf,"Figure 8.17. Latitudinal distributions of the zonally averaged surface air temperature (a, b) and precipitation 
rate (c, d) for boreal winter (DJF) (a, c) and boreal summer (JJA) (b, d) as simulated at equilibrium by some of 
the EMICs used in Chapter 10 (see Table 8.3) for an atmospheric CO2 concentration of 280 ppm. In (a) and (b), 
observational data merged from Jennings (1975), Jones (1988), Schubert et al. (1992), da Silva et al. (1994) and 
Fiorino (1997) are shown by crosses. In (c) and (d), observation-based estimates from Jaeger (1976; crosses) and 
Xie and Arkin (1997; open circles) are shown. The vertical grey bars indicate the range of GCM results from AMIP 
and CMIP1 (see text). Note that the model versions used in this intercomparison have no interactive biosphere 
and ice sheet components. The MIT-UW model is an earlier version of MIT-IGSM2.3. Adapted from Petoukhov et 
al., 2005.",./images/1964.png
1966,Fourth National Climate Assessment  Volume I.pdf,"Figure 6.4. Observed changes in cold and heat waves in the contiguous United States. The top panel depicts changes 
in the frequency of cold waves; the middle panel depicts changes in the frequency of heat waves; and the bottom panel 
depicts changes in the intensity of heat waves. Cold and heat wave frequency indices are defined in Zhang et al.,15 and 
the heat wave intensity index is defined in Russo et al.14 Estimates are derived from long-term stations with minimal 
missing data in the Global Historical Climatology Network-Daily dataset.16 (Figure source: NOAA/NCEI). ",./images/1966.png
1969,WGIII_TAR_full_report.pdf,"Figure 10.3: Relationship between present discounted costs
for stabilizing the concentration of carbon dioxide in the
atmosphere at alternative levels from two studies. Costs are
discounted at 5%/yr over the time period 1990 to 2100.
Sources: Manne and Richels (1997) and Edmonds et al.
(1997).",./images/1969.png
1970,ABCE_Uganda_finalreport_Jan2015.pdf,"Figure 27 Range and composition of average 
output production across platforms, 2011",./images/1970.png
1972,WGIII_TAR_full_report.pdf,"Figure 3.13c - d: Relative levels of energy efficiency for selected industrial sectors in various countries. The aggregate energy efficiency index (EEI) is calculated as: EEI = (Σi Pi ·SECi)/( Σi Pi · SECi,BP), where Pi is the production volume of product i; SECi is the specific energy consumption for product i, and SECi,BP is a best-prac-tice reference level for the specific energy consumption for product i. By applying this approach a correction is made in order to account for structural differences between countries in each of the tracked industrial sectors. A typical statistical uncertainty for these figures is 5%. Because of statistical errors higher uncertainties may occur in individual cases.",./images/1972.png
1978,Tracking Universal Health Coverage 2017.pdf,"Fig. 2.5 Inequalities in incidence of catastrophic spending using the SDG indicator 3.8.2, or the actual nonfood approach, 
latest year",./images/1978.png
1979,WGI_TAR_full_report.pdf,"Figure 4.12: July zonal mean increase in tropospheric O3 (ppb) as a function of latitude and altitude from Y2000 to Y2100 adopting SRES A2p
projections for CH4, CO, VOC, and NOx. Results are shown for a sample of the chemistry-transport models (CTM) participating in IPCC
OxComp workshop. Increases range from 0 to more than 80 ppb. Changes in the stratosphere (defined as O3 > 150 ppb in that model's Y2000
simulation) are masked off, as are also regions in the upper troposphere for some CTMs (UKMO, HGIS) where O3 is not explicitly calculated.
See Table 4.10 for participating models.",./images/1979.png
1980,SRREN_Full_Report-1.pdf,"Figure 8.9 | Relative costs for distributing and dispensing biomethane (either compressed 
or liquefi ed) at the medium scale by truck or pipeline (Ahman, 2010). ",./images/1980.png
1982,WGIIAR5-PartA_FINAL.pdf,"Figure 3-5 | Change in mean monthly runoff across seven climate models in seven catchments, with a 2°C increase in global mean temperature above 1961–1990 (Kingston
and Taylor, 2010; Arnell, 2011; Hughes et al., 2011; Kingston et al., 2011; Nobrega et al., 2011; Thorne, 2011; Xu et al., 2011). One of the seven climate models (HadCM3) is
highlighted separately, showing changes with both a 2°C increase (dotted line) and a 4°C increase (solid line).",./images/1982.png
1988,2007 The Physical Science Basis.pdf,"Figure 11.11. Temperature anomalies with respect to 1901 to 1950 for fi ve North American land regions for 1906 to 2005 (black line) and as simulated (red envelope) by 
MMD models incorporating known forcings; and as projected for 2001 to 2100 by MMD models for the A1B scenario (orange envelope). The bars at the end of the orange enve-
lope represent the range of projected changes for 2091 to 2100 for the B1 scenario (blue), the A1B scenario (orange) and the A2 scenario (red). The black line is dashed where 
observations are present for less than 50% of the area in the decade concerned. More details on the construction of these fi gures are given in Box 11.1 and Section 11.1.2.",./images/1988.png
1992,WGI_TAR_full_report.pdf,"Figure 12.10: Comparison between the amplitude of anthropogenic signals from observed and modelled JJA trend patterns using fingerprints from
two different climate models (ECHAM3/LSG and HadCM2) and data from five climate models. (a) Comparison of the amplitude of a single
greenhouse gas + sulphate aerosol (GS) signal (expressed as change in global mean temperature [°C] over 50 years). Results show that a significant
GS signal can be detected in observed trend patterns 1949 to 1998 at a 5% significance level (one-sided test), independent of which pair of finger-
prints was used. The observed signal amplitude is consistent with contemporaneous GS amplitudes for most models’ GS simulations. 90%
confidence intervals are shown by solid lines for estimates using ECHAM3/LSG fingerprints and by dashed lines for estimates based on HadCM2
fingerprints. Cases where a model’s and the observed amplitude disagree are marked by a cross on the axis. (b) and (c) show an estimate of the
observed amplitude of a greenhouse gas signal (horizontal axis) and a sulphate aerosol signal (vertical axis) estimated simultaneously. Both signal
amplitudes can be estimated as positive from observations based on ECHAM3/LSG fingerprints shown in (b) while only the greenhouse gas signal
is detected based on HadCM2 fingerprints shown in panel (c). The amplitudes of both signals from the observations are compared with those from
model simulations forced with various forcing histories and using different climate models (1: HadCM2; 2: ECHAM3/LSG; 3: GFDL; 4:
ECHAM4/OPYC; 5: CCCma1; 6: CCCma2). Simulations with symbols shown in black are consistent with observations relative to the uncertainty
in observations (grey ellipse) and that of the model simulations (not shown). Simulations which are inconsistent are shown in grey. Model simula-
tions where only a single ensemble member is available are illustrated by thin symbols, those based on ensembles of simulations by fat symbols.
Results from consistency tests indicate that most greenhouse gas only simulations (G, shown by “×”) are inconsistent with observations. Ten of
the GS simulations in both panels are in agreement with observed trend patterns, discrepancies arise mostly from the magnitude of a sulphate signal
(vertical axis). The failure to detect a sulphate signal as well as a greenhouse gas signal in panel (c) is due to the two signals being very highly
correlated if only spatial patterns are used- this makes separation of the signals difficult. These results show that estimates of a sulphate aerosol
signal from observations are model dependent and quite uncertain, while a single anthropogenic signal can be estimated with more confidence.
All units are in °C/50 year, values in the upper right quadrant refer to a physically meaningful greenhouse warming and sulphate aerosol cooling
signal. The consistency test establishes whether the difference between a model’s and the observed amplitude estimate is significantly larger than the
combined uncertainty in the observations (internal variability + observational uncertainty) and the model simulation (internal variability). The figure
is derived by updating the data used by Barnett et al. (1999) (for details of the analysis see Hegerl et al., 2000) and then applying a simple linear
transformation of the multi-regression results (Hegerl and Allen, 2000).
Results for 1946 to 1995 period used by Barnett et al. (1999) are similar, except fewer of the models in b and c agree with observations and the
case of both signals being zero in c is not rejected. Simulations of natural forcing only ending before 1998 are also rejected in that case.",./images/1992.png
1996,2007 The Physical Science Basis.pdf,"Figure 10.26. Fossil CO2, CH4 and SO2 emissions for six illustrative SRES non-mitigation emission scenarios, their corresponding CO2, CH4 and N2O concentrations, radiative 
forcing and global mean temperature projections based on an SCM tuned to 19 AOGCMs. The dark shaded areas in the bottom temperature panel represent the mean +-1 
standard deviation for the 19 model tunings. The lighter shaded areas depict the change in this uncertainty range, if carbon cycle feedbacks are assumed to be lower or higher 
than in the medium setting. Mean projections for mid-range carbon cycle assumptions for the six illustrative SRES scenarios are shown as thick coloured lines. Historical emis-
sions (black lines) are shown for fossil and industrial CO2 (Marland et al., 2005), for SO2 (van Aardenne et al., 2001) and for CH4 (van Aardenne et al., 2001, adjusted to Olivier 
and Berdowski, 2001). Observed CO2, CH4 and N2O concentrations (black lines) are as presented in Chapter 6. Global mean temperature results from the SCM for anthropogenic 
and natural forcing compare favourably with 20th-century observations (black line) as shown in the lower left panel (Folland et al., 2001; Jones et al., 2001; Jones and Moberg, 
2003).",./images/1996.png
1999,IHME_GBD2015_report.pdf,"Figure 23 Age-standardized YLDs per 100,000, by region and cause, 2015",./images/1999.png
2001,SRREN_Full_Report-1.pdf,"Figure 8.22 | Relative performance of current building technologies to meet heat energy 
demand compared with future designs of energy-effi cient buildings with integrated RE 
systems and related investment costs (from base year 2005 = 100), based on a full-scale 
demonstration project in Finland (VTT, 2009). ",./images/2001.png
2004,PolicyReport_IHME_GBD-Norway_2016.pdf,figure 10 top risk factors for early death ylls among ages 50 to 69 norway 2013,./images/2004.png
2006,PolicyReport_IHME_GBD-Norway_2016.pdf,figure 10 top risk factors for early death ylls among ages 50 to 69 norway 2013,./images/2006.png
2007,2007 The Physical Science Basis.pdf,"Figure 9.6. Trends in observed and simulated temperature changes (degC) over the 1901 to 2005 (left column) and 1979 
to 2005 (right column) periods. First row: trends in observed temperature changes (Hadley Centre/Climatic Research 
Unit gridded surface temperature data set (HadCRUT3), Brohan et al., 2006). Second row: average trends in 58 historical 
simulations from 14 climate models including both anthropogenic and natural forcings. Third row: average trends in 19 
historical simulations from fi ve climate models including natural forcings only. Grey shading in top three rows indicates 
regions where there are insuffi cient observed data to calculate a trend for that grid box (see Supplementary Material, 
Appendix 9.C for further details of data exclusion criteria). Fourth row: average trends for each latitude; observed 
trends are indicated by solid black curves. Red shading indicates the middle 90% range of trend estimates from the 
58 simulations including both anthropogenic and natural forcings (estimated as the range between 4th and 55th of the 
58 ranked simulations); blue shading indicates the middle 90% range of trend estimates from the 19 simulations with 
natural forcings only (estimated as the range between 2nd and 18th of the 19 ranked simulations); for comparison, the 
dotted black curve in the right-hand plot shows the observed 1901 to 2005 trend. Note that scales are different between 
columns. The 'ALL' simulations were extended to 2005 by adding their IPCC Special Report on Emission Scenarios 
(SRES) A1B continuation runs where available. Where not available, and in the case of the 'NAT' simulations, the mean 
for the 1996 to 2005 decade was estimated using model output from 1996 to the end of the available runs. In all plots, 
each climate simulation was sampled so that coverage corresponds to that of the observations. Further details of the 
models included and the methodology for producing this fi gure are given in the Supplementary Material, Appendix 9.C.",./images/2007.png
2008,2007 The Physical Science Basis.pdf,"Figure 6.13. Radiative forcings and simulated temperatures during the last 1.1 kyr. Global mean radiative forcing (W m-2) used to drive climate model simulations due to (a) 
volcanic activity, (b) solar irradiance variations and (c) all other forcings (which vary between models, but always include greenhouse gases, and, except for those with dotted 
lines after 1900, tropospheric sulphate aerosols). (d) Annual mean NH temperature (degC) simulated under the range of forcings shown in (a) to (c), compared with the concentra-
tion of overlapping NH temperature reconstructions (shown by grey shading, modifi ed from Figure 6.10c to account for the 1500 to 1899 reference period used here). All forc-
ings and temperatures are expressed as anomalies from their 1500 to 1899 means and then smoothed with a Gaussian-weighted fi lter to remove fl uctuations on time scales 
less than 30 years; smoothed values are obtained up to both ends of each record by extending the records with the mean of the adjacent existing values. The individual series 
are identifi ed in Table 6.2.",./images/2008.png
2012,2007 The Physical Science Basis.pdf,"Figure 7.7. Regional ocean-atmosphere and land-atmosphere CO2 fl uxes for the NH (top) and the globe 
(bottom) from inversion ensembles and bottom-up studies. Fluxes to the atmosphere are positive and 
uptake has a negative sign. Inversion results all correspond to the post-Pinatubo period 1992 to 1996. 
Orange: Bottom-up terrestrial fl uxes from Pacala et al. (2001) and Kurz and Apps (1999) for North America, 
from Janssens et al. (2003) for Europe and from Shvidenko and Nilsson (2003) plus Fang et al. (2001) for 
North Asia (Asian Russia and China). Cyan (fi lled circles): Bottom-up ocean fl ux estimates from Takahashi, 
et al. (2002). Blue: ocean fl uxes from atmospheric inversions. Green: terrestrial fl uxes from inversion 
models. Magenta: total inversion fl uxes. Red: fossil fuel emissions. The mean fl ux of different inversion 
ensembles is reported. Inversion errors for regional fl uxes are not reported here; their values usually range 
between 0.5 and 1 GtC yr-1. Error bar: range of atmospheric inversion fl uxes from the TAR. Squares: Gurney 
et al. (2002) inversions using annual mean CO2 observations and 16 transport models. Circles: Gurney et al. 
(2003) inversions using monthly CO2 observations and 13 transport models. Triangles: Peylin et al. (2005) 
inversions with three transport models, three regional breakdowns and three inversion settings. Inverted 
triangles: Rodenbeck et al. (2003a) inversions where the fl uxes are solved on the model grid using monthly 
fl ask data.",./images/2012.png
2016,2007 The Physical Science Basis.pdf,"Figure 3.28. Pacifi c Decadal Oscillation: (top) SST based on the leading EOF SST 
pattern for the Pacifi c basin north of 20degN for 1901 to 2004 (updated; see Mantua et 
al., 1997; Power et al., 1999b) and projected for the global ocean (units are nondi-
mensional); and (bottom) annual time series (updated from Mantua et al., 1997). The 
smooth black curve shows decadal variations (see Appendix 3.A).",./images/2016.png
