image_id,source,caption,image_path
7,WGI_TAR_full_report.pdf,"Figure 12.12: (a) Estimates of the “scaling factors” by which we have to multiply the amplitude of several model-simulated signals to reproduce
the corresponding changes in the observed record. The vertical bars indicate the 5 to 95% uncertainty range due to internal variability. A range
encompassing unity implies that this combination of forcing amplitude and model-simulated response is consistent with the corresponding
observed change, while a range encompassing zero implies that this model-simulated signal is not detectable (Allen and Stott, 2000; Stott et al.,
2000a). Signals are defined as the ensemble mean response to external forcing expressed in large-scale (>5000 km) near-surface temperatures over
the 1946 to 1996 period relative to the 1896 to 1996 mean. The first entry (G) shows the scaling factor and 5 to 95% confidence interval obtained
if we assume the observations consist only of a response to greenhouse gases plus internal variability. The range is significantly less than one
(consistent with results from other models), meaning that models forced with greenhouse gases alone significantly overpredict the observed
warming signal. The next eight entries show scaling factors for model-simulated responses to greenhouse and sulphate forcing (GS), with two
cases including indirect sulphate and tropospheric ozone forcing, one of these also including stratospheric ozone depletion (GSI and GSIO respec-
tively). All but one (CGCM1) of these ranges is consistent with unity. Hence there is little evidence that models are systematically over- or under-
predicting the amplitude of the observed response under the assumption that model-simulated GS signals and internal variability are an adequate
representation (i.e. that natural forcing has had little net impact on this diagnostic). Observed residual variability is consistent with this assumption
in all but one case (ECHAM3, indicated by the asterisk). We are obliged to make this assumption to include models for which only a simulation
of the anthropogenic response is available, but uncertainty estimates in these single-signal cases are incomplete since they do not account for
uncertainty in the naturally forced response. These ranges indicate, however, the high level of confidence with which we can reject internal
variability as simulated by these various models as an explanation of recent near-surface temperature change.
A more complete uncertainty analysis is provided by the next three entries, which show corresponding scaling factors on individual
greenhouse (G), sulphate (S), solar-plus-volcanic (N), solar-only (So) and volcanic-only (V) signals for those cases in which the relevant simula-
tions have been performed. In these cases, we estimate multiple factors simultaneously to account for uncertainty in the amplitude of the naturally
forced response. The uncertainties increase but the greenhouse signal remains consistently detectable. In one case (ECHAM3) the model appears
to be overestimating the greenhouse response (scaling range in the G signal inconsistent with unity), but this result is sensitive to which
component of the control is used to define the detection space. It is also not known how it would respond to the inclusion of a volcanic signal. In
cases where both solar and volcanic forcing is included (HadCM2 and HadCM3), G and S signals remain detectable and consistent with unity
independent of whether natural signals are estimated jointly or separately (allowing for different errors in S and V responses). (b) Estimated
contributions to global mean warming over the 20th century, based on the results shown in (a), with 5 to 95% confidence intervals. Although the
estimates vary depending on which model’s signal and what forcing is assumed, and are less certain if more than one signal is estimated, all show
a significant contribution from anthropogenic climate change to 20th century warming (from Allen et al., 2000a).",./images/7.png
10,WGIII_TAR_full_report.pdf,"Figure 9.3: Effect of seasonal O3 concentrations on agricultural crop yields derived from a Weibull Parametric Fit of NCLAN
O3 exposure and yield data (Adams et al., 1989, adapted by Chameides et al., 1999)",./images/10.png
12,ar4_wg3_full_report-1.pdf,"Figure 9.8: OECD North America: technical potential for the forest sector alone for Canada (left, sink is positive) and the economic potential (at 15 US$/tCO2eq in constant real 
prices) in the agriculture and forestry sector in the USA (right) Left: Chen et al., 2000; right: US-EPA, 2005",./images/12.png
13,SRREN_Full_Report-1.pdf,"Figure 7.8 | Global annual wind power capacity additions and cumulative capacity (Data sources: GWEC, 2010a; Wiser and Bolinger, 2010).",./images/13.png
14,"2007 Impact, adaption.pdf","Figure 10.2. Projected number of hot days (>30degC) and days of heavy rainfall (>100 mm/day) by the high resolution general circulation model
(Hasumi and Emori, 2004).",./images/14.png
20,SRREN_Full_Report-1.pdf,"Figure 7.16 | Wind energy, electricity demand and instantaneous penetration levels in (left) West Denmark for a week in January 2005, and (right) the island of Ireland for two days 
in April 2010. Source: Data from (left) www.energinet.dk; (right) www.eirgrid.com and System Operator for Northern Ireland.",./images/20.png
26,WGIII_TAR_full_report.pdf,"Figure 8.19: Average GDP and CO2 reductions in 550ppmv stabilization scenarios: year 2050 (labels identify different scenario
groups).",./images/26.png
30,ar4_wg3_full_report-1.pdf,Figure 10.6b: Regional distribution of N2O emissions from human sewage in 1990 and 2020. See Table 10.3 for total emissions.,./images/30.png
45,CARBON DIOXIDE CAPTURE AND STORAGE.pdf,"Figure 3.7 Percentage increase in fuel use per kWh of electricity due to CO2 capture, compared to the same plant without capture (Source data:
Davison, 2005; IEA GHG, 2004; IEA GHG, 2003; IEA GHG, 2000b; Dillon et al., 2005).
a. The increase in fuel required to produce a kWh of electricity is calculated by comparing the same type of plant with and without capture. The
increase in fuel consumption depends on the type of baseline plant without capture. For example, the increase in energy consumption for a GE
IGCC plant with capture compared to a coal steam cycle baseline plant without capture would be 40% as opposed to the lower value shown
in the figure that was calculated relative to the same type of baseline plant without capture.
b. The direct energy consumptions for CO2 separation are lower for pre-combustion capture than for post-combustion capture, because CO2
is removed from a more concentrated, higher pressure gas, so a physical rather than a chemical solvent can be used.
c. The ‘Fuel gas processing and related impacts’ category for IGCC includes shift conversion of the fuel gas and the effects on the gas turbine
combined cycle of removal of CO2 from the fuel gas and use of hydrogen as a fuel instead of syngas. For natural gas pre-combustion capture
this category also includes partial oxidation/steam reforming of the natural gas.
d. The energy consumption for CO2 compression is lower in pre-combustion capture than in post-combustion capture because some of the CO2
leaves the separation unit at elevated pressure.
e. The energy consumption for CO2 compression in the oxy-fuel processes depends on the composition of the extracted product, namely 75%
by volume in the coal-fired plant and 93% by volume in the gas fired plant. Impurities are cryogenically removed from the CO2
during compression, to give a final CO2 purity of 96% by volume. The energy consumption of the cryogenic CO2
separation unit is included in the CO2 compression power consumption.
f. The ‘Oxygen production and power plant impacts’ category for oxy-fuel processes includes the power consumption for oxygen production
and the impacts of CO2 capture on the rest of the power plant, that is excluding CO2 compression and purification. In the coal-fired oxy-fuel
plant, the efficiency of the rest of the power plant increases slightly, for example due to the absence of a flue gas desulphurization (FGD)
unit. The efficiency of the rest of the gas fired oxy-fuel plant decreases because of the change of working fluid in the power cycle from air to
recycled flue gas.",./images/45.png
70,ar4_wg3_full_report-1.pdf,"Figure 13.3: Evolution of the Clean Development Mechanism portfolio in terms of CO2 -equivalents per year and number of projects. 
Source: Ellis and Karousakis (2006).",./images/70.png
82,Research for Universal Health Coverage 2013.pdf,fig 23 private and publicsector investment in rd classified as basic applied and experimental development research for six african countries ranked in ascending order of gross national income left to right,./images/82.png
84,IHME_Policy-report_Maternal-child-health-in-America_2016.pdf,"Figure 8: Top 10 injuries among children under 5 in the United States, 1990-2013",./images/84.png
90,ar4_wg3_full_report-1.pdf,"Figure 3.6: Development of carbon intensity of energy (left) and primary energy intensity of GDP (right). Historical development and projections from SRES and pre-SRES 
scenarios compared to post-SRES scenarios. ",./images/90.png
98,ar4_wg3_full_report-1.pdf,"Figure 3.3: Comparison of global GDP growth per person in the SRES scenarios and more recent projections. 
Notes: SRES = (Nakicenovic et al., 2000), WB = World Bank (World Bank, 2004), DoE = assumptions used by US Department of Energy (USDOE, 2004), 
IEA assumptions used by IEA (IEA, 2002 and 2004); (Van Vuuren and O'Neill, 2006).",./images/98.png
102,Climate Change 2007 - Synthesis Report.pdf,"Figure 2.2. (a) Distribution of regional per capita GHG emissions according to the population of different country groupings in 2004 (see appendix for
definitions of country groupings). (b) Distribution of regional GHG emissions per US$ of GDPPPP over the GDP of different country groupings in 2004. The
percentages in the bars in both panels indicate a region's share in global GHG emissions. {WGIII Figures SPM.3a, SPM.3b}",./images/102.png
104,ar4_wg3_full_report-1.pdf,"Figure 3.26: Reduction of emissions in the CO2-only versus multi-gas strategies.
Source: De la Chesnaye and Weyant, 2006 (see also Van Vuuren et al., 2006b)",./images/104.png
107,SR15_Chapter_2_LR.pdf,"Figure 2.25 | Agricultural emissions in transformation pathways. Global agricultural (a) CH4 and (b) N2O emissions. Box plots show median, interquartile range and full 
range. Classes are defined in Section 2.1. ",./images/107.png
108,Research for Universal Health Coverage 2013.pdf,fig 22 the share of internationally coauthored science and engineering articles worldwide by country 2000 and 2010,./images/108.png
112,ar4_wg3_full_report-1.pdf,"Figure 3.19: Relationship between the stringency of the stabilization target (category I to VI) and 1) the time at which CO2 emissions have to peak (left-hand panel), and 2) the 
year when emissions return to present (2000) levels. ",./images/112.png
122,ar4_wg3_full_report-1.pdf,"Figure 3.24: Primary energy mix for the years 2030 and 2100. Illustrative scenarios aim at stabilizing radiative forcing at low (3-3.6 W/m2) and intermediate levels 
(4.5 W/m2) respectively. 
Note: BL= Baseline. For the corresponding contribution of individual mitigation measures in (in GtCO2) see also Figure 3.23.",./images/122.png
125,WGIII_TAR_full_report.pdf,"Figure 2.17: Timing of when per capita CO2 emissions in Annex I countries would fall below per capita CO2 emissions in non-
Annex I countries, assuming that all CO2 emission reduction necessary for stabilization would occur in Annex I countries and
that non-Annex I countries would emit CO2 without any controls.",./images/125.png
126,Fourth National Climate Assessment  Volume I.pdf,"Figure 1.6: Comparison of global mean temperature anomalies (degF) from observations (through 2016) and the 
CMIP5 multimodel ensemble (through 2016), using the reference period 1901-1960. The CMIP5 multimodel 
ensemble (orange range) is constructed from blended surface temperature (ocean regions) and surface air tem-
perature (land regions) data from the models, masked where observations are not available in the GISTEMP data-
set.27 The importance of using blended model data is shown in Richardson et al.42 The thick solid orange curve 
is the model ensemble mean, formed from the ensemble across 36 models of the individual model ensemble 
means. The shaded region shows the +/- two standard deviation range of the individual ensemble member annual 
means from the 36 CMIP5 models. The dashed lines show the range from maximum to minimum values for each 
year among these ensemble members. The sources for the three observational indices are: HadCRUT4.5 (red): 
http://www.metoffice.gov.uk/hadobs/hadcrut4/data/current/download.html; NOAA (black): https://www.ncdc.noaa.
gov/monitoring-references/faq/anomalies.php; and GISTEMP (blue): https://data.giss.nasa.gov/pub/gistemp/gis-
temp1200_ERSSTv4.nc. (NOAA and HadCRUT4 downloaded on Feb. 15, 2017; GISTEMP downloaded on Feb. 
10, 2017). (Figure source: adapted from Knutson et al. 201627).",./images/126.png
127,IHME_Policy-report_Maternal-child-health-in-America_2016.pdf,"Figure 7: Percentage of deaths due to NCDs, communicable diseases, 
and injuries among young children in 2013 in the United States",./images/127.png
139,Climate Change 2007 - Synthesis Report.pdf,"Figure 4.1. Global economic mitigation potential in 2030 estimated from bottom-up (Panel a) and top-down (Panel b) studies, compared with the projected
emissions increases from SRES scenarios relative to year 2000 GHG emissions of 40.8 GtCO2-eq (Panel c). Note: GHG emissions in 2000 are exclusive of
emissions of decay of above-ground biomass that remains after logging and deforestation and from peat fires and drained peat soils, to ensure consistency
with the SRES emissions results. {WGIII Figures SPM.4, SPM.5a, SPM.5b}",./images/139.png
140,SRREN_Full_Report-1.pdf,"Figure 7.22 | Fleet-wide average capacity factors for a large sample of wind power plants in the USA from 1999 to 2009 (Wiser and Bolinger, 2010). ",./images/140.png
142,ar4_wg3_full_report-1.pdf,"Figure 3.9: Comparison of various long-term scenario studies for CO2 emissions. Left panel: IPCC SRES, EMF-21 range (grey area), indicating the range of the lowest and 
highest reported values in the EMF-21 study (Weyant et al., 2006). Right panel: Webster et al. (2002) and Richels et al. (2004), indicating the mean (markers) and 95% intervals 
of the reported ranges of these studies (for the latter, showing the 95% interval of the combined range for optimistic and pessimistic technology). ",./images/142.png
147,WGIII_TAR_full_report.pdf,"Figure 4.9: Indicative curves of costs (US$/tC, cost of US$28/tC is equivalent to US$100 per tonne of CO2) of emission reduc-
tion or carbon sequestration by level of total reduction. The curves display how comparable options vary in costs between world
regions. However, costs per option are also reported to vary widely at comparable total levels of reduction. This is mainly
because cost studies have not been carried out in the same way. In some options net monetary profit may occur as well (i.e., costs
may be negative as well) (Brown et al., 1996a, Hol et al., 1999; Jepma et al., 1997; Sedjo et al., 1995). ",./images/147.png
148,Climate Change 2007 - Synthesis Report.pdf,"Figure 5.1. Global CO2 emissions for 1940 to 2000 and emissions ranges for categories of stabilisation scenarios from 2000 to 2100 (left-hand panel); and
the corresponding relationship between the stabilisation target and the likely equilibrium global average temperature increase above pre-industrial (right-
hand panel). Approaching equilibrium can take several centuries, especially for scenarios with higher levels of stabilisation. Coloured shadings show
stabilisation scenarios grouped according to different targets (stabilisation category I to VI). The right-hand panel shows ranges of global average tempera-
ture change above pre-industrial, using (i) 'best estimate' climate sensitivity of 3degC (black line in middle of shaded area), (ii) upper bound of likely range of
climate sensitivity of 4.5degC (red line at top of shaded area) (iii) lower bound of likely range of climate sensitivity of 2degC (blue line at bottom of shaded area).
Black dashed lines in the left panel give the emissions range of recent baseline scenarios published since the SRES (2000). Emissions ranges of the
stabilisation scenarios comprise CO2-only and multigas scenarios and correspond to the 10th to 90th percentile of the full scenario distribution. Note: CO2
emissions in most models do not include emissions from decay of above ground biomass that remains after logging and deforestation, and from peat fires
and drained peat soils. {WGIII Figures SPM.7 and SPM.8}",./images/148.png
149,WGIII_TAR_full_report.pdf,"Figure 2.15: Timing when the stabilization scenarios achieve a reduction of 20% of global energy-related CO2 baseline emis-
sions, compared across stabilization targets as well as baselines. Slanted lines join scenarios quantified by the same model.",./images/149.png
151,Climate Change 2001 Synthesis Report.pdf,"Figure 5-3: Stabilizing CO2 emissions at current levels will result in a continously rising atmospheric
CO2 concentration and temperature. Stabilization of atmospheric CO2 and temperature change will eventually require the emissions to drop well below current levels. In all three panels the red curves illustrate the result of emissions held constant at the
level prescribed by the WRE 550 profile for the year 2000 (which is slightly higher than the actual emissions for the year 2000), while the blue
curves are the result of emissions following the WRE 550 stabilization profile. Both cases are illustrative only: Constant global emissions are
unrealistic in the short term, and no preference is expressed for the WRE 550 profile over others. Other stabilization profiles are illustrated in
Figure 6-1. Figure 5-3 was constructed using the models described in WGI TAR Chapters 3 & 9.",./images/151.png
152,SRREN_Full_Report-1.pdf,"Figure 1.3 | Left panel: Projected increase in primary energy supply. Comparison of 153 SRES and pre-SRES baseline energy scenarios in the literature compared with the 133 more 
recent, post-SRES scenarios. The ranges are comparable, with small changes in the lower and upper boundaries. Right panel: Expected carbon intensity changes. Historical development 
and projections from SRES and pre-SRES scenarios compared to post-SRES scenarios. Adapted from Fisher et al., 2007, pp. 183 and 184.",./images/152.png
157,"2007 Impact, adaption.pdf","Figure 1.4. (a) Differences between the mean onset of spring (days) in Europe for the 10 years with the highest (1990, 1882, 1928, 1903, 1993,
1910, 1880, 1997, 1989, 1992) and the lowest (1969, 1936, 1900, 1996, 1960, 1932, 1886, 1924, 1941, 1895) NAO winter and spring index
(November to March) drawn from the period 1879 to 1998. After Menzel et al. (2005b). (b) Anomalies of different phenological phases in Germany
(mean spring passage of birds at Helgoland, North Sea; mean egg-laying of pied flycatcher in Northern Germany; national mean onset of leaf
unfolding of common horse-chestnut (Aesculus hippocastanum) and silver birch (Betula pendula) (negative = earlier)), anomalies of mean spring air
temperature T (HadCRUT3v) and North Atlantic Oscillation index (NAO) (http://www.cru.uea.ac.uk/cru/data/). Updated after Walther et al. (2002).",./images/157.png
161,https://drive.google.com/file/d/10nPf3bjcz_4JhMjpFH1iUF29QkW8s5Yl/view?usp=drive_link,"Cross-Chapter Box 12, Figure 1 | Stylized reduced risk levels due to avoided impacts between 2°C and 1.5°C warming (in solid red-orange), additional
avoided impacts with adaptation under 2°C (striped orange) and under 1.5°C (striped yellow), and unavoidable impacts (losses) with no or very limited
potential for adaptation (grey), extracted from the AR5 WGII risk tables (Field et al., 2014), and underlying chapters by Adger et al. (2014) and Olsson et al.
(2014). For some systems and sectors (A), achieving 1.5°C could reduce risks to low (with adaptation) from very high (without adaptation) and high (with
adaptation) under 2°C. For other areas (C), no or very limited adaptation potential is anticipated, suggesting limits, with the same risks for 1.5°C and 2°C.
Other risks are projected to be medium under 2°C with further potential for reduction, especially with adaptation, to very low levels (B).",./images/161.png
165,Prospective_Country_Evaluation_DRC_annual_report_2019.pdf,"Figure 13. Model estimates of incidence, prevalence and mortality, 2000-2017. ",./images/165.png
173,WGII_TAR_full_report-2.pdf,"Figure 10-1: Rainfall fluctuations, 1901-1998, expressed as
regionally averaged standard deviation (departure from long-
term mean divided by standard deviation) for the Sahel.",./images/173.png
174,SRREN_Full_Report-1.pdf,"Figure TS.10.7 | Mitigation costs from the RECIPE project under varying assumptions regarding technology availability for a long-term stabilization level of 450 ppmv CO2. Option
values of technologies in terms of consumption losses for scenarios in which the option indicated is foregone (CCS) or limited to baseline levels (all other technologies) for the periods
a) 2005 to 2030 and b) 2005 to 2100. Option values are calculated as differences in consumption losses for a scenario in which the use of certain technologies is limited with respect
to the baseline scenario. Note that for WITCH, the generic backstop technology was assumed to be unavailable in the ‘fi x RE’ scenario. [Figure 10.12]",./images/174.png
175,Guatemala_PCE_annual_country_report_2019_English.pdf,"Figure 24. Comparison of expenditure rates for programs of malaria, HIV and TB, 2015 -2017 ",./images/175.png
181,Research for Universal Health Coverage 2013.pdf,fig 310 projected changes in per capita public health expenditure associated with ageing in five european countries 20102060,./images/181.png
182,SRREN_Full_Report-1.pdf,"Figure 7.10 | Annual wind power capacity additions by region (Data source: GWEC, 2010a).",./images/182.png
183,WGI_TAR_full_report.pdf,"Figure 9.22: Time-series of the zonally integrated Atlantic mass transport stream function at 30degN and 1500 m depth, close to the maximum of the
stream function simulated by the (a) ECHAM3/LSG model and the (b) GFDL_R15_b model. For a description of the experiments see Table 9.5.",./images/183.png
184,SR15_Chapter_3_LR.pdf,"Figure 3.10 | Probability ratio (PR) of exceeding (heavy precipitation) thresholds. (a) PR of exceeding the 99th (blue) and 99.9th (red) percentile of pre-industrial daily 
precipitation at a given warming level, averaged across land (from Fischer and Knutti, 2015). (b) PR for precipitation extremes (RX1day) for different event probabilities (with RV 
indicating return values) in the current climate (1degC of global warming). Shading shows the interquartile (25-75%) range (from Kharin et al., 2018).",./images/184.png
186,SYR_AR5_FINAL_full.pdf,"Figure 1.5 | Annual global anthropogenic carbon dioxide (CO2) emissions (gigatonne of CO2-equivalent per year, GtCO2/yr) from fossil fuel combustion, cement production and 
flaring, and forestry and other land use (FOLU), 1750-2011. Cumulative emissions and their uncertainties are shown as bars and whiskers, respectively, on the right-hand side. The 
global effects of the accumulation of methane (CH4) and nitrous oxide (N2O) emissions are shown in Figure 1.3. Greenhouse gas emission data from 1970 to 2010 are shown in 
Figure 1.6. {modified from WGI Figure TS.4 and WGIII Figure TS.2}",./images/186.png
187,2007 The Physical Science Basis.pdf,"Figure 3.38. Annual probability distribution functions for temperature indices for 202 global stations with at 
least 80% complete data between 1901 and 2003 for three time periods: 1901 to 1950 (black), 1951 to 1978 
(blue) and 1979 to 2003 (red). The x-axis represents the percentage of time during the year when the indicators 
were below the 10th percentile for cold nights (left) or above the 90th percentile for warm nights (right). From 
Alexander et al. (2006).",./images/187.png
188,ar4_wg3_full_report-1.pdf,"Figure 3.14: Total black carbon (left panel) and organic carbon (right panel) emission estimates in scenarios from different studies. 
Notes: Rao et al., (2005) include emissions from contained combustion only. Liousse et al. (2005), A2 not included as 2100 value of 100 Tg lies way above range.",./images/188.png
189,WGI_TAR_full_report.pdf,"Figure 13.5: Spatial pattern of differences (future climate minus baseline) in simulated corn yields based on two different climate change
scenarios for the region covering north-west Iowa and surrounding states (a) coarse spatial resolution GCM scenario (CSIRO); (b) high spatial
resolution region climate model scenario (RegCM) (modified from Mearns et al., 1999).",./images/189.png
191,WGIII_TAR_full_report.pdf,Figure 3.3: Total net resource flows to aid recipient countries.,./images/191.png
194,"2007 Impact, adaption.pdf","Figure 2.3. Idealised version of a coping range showing the relationship between climate change and threshold exceedance, and how adaptation
can establish a new critical threshold, reducing vulnerability to climate change (modified from Jones and Mearns, 2005).",./images/194.png
