image_id,source,caption,image_path
1233,SYR_AR5_FINAL_full.pdf,"Figure 2.3 | Global mean surface temperature increase as a function of cumulative total global carbon dioxide (CO2) emissions from various lines of evidence. Multi-model results 
from a hierarchy of climate carbon-cycle models for each Representative Concentration Pathway (RCP) until 2100 are shown (coloured lines). Model results over the historical period 
(1860 to 2010) are indicated in black. The coloured plume illustrates the multi-model spread over the four RCP scenarios and fades with the decreasing number of available models 
in RCP8.5. Dots indicate decadal averages, with selected decades labelled. Ellipses show total anthropogenic warming in 2100 versus cumulative CO2 emissions from 1870 to 2100 
from a simple climate model (median climate response) under the scenario categories used in WGIII. Temperature values are always given relative to the 1861-1880 period, and 
emissions are cumulative since 1870. Black filled ellipse shows observed emissions to 2005 and observed temperatures in the decade 2000-2009 with associated uncertainties. 
{WGI SPM E.8, TS TFE.8, Figure 1, TS.SM.10, 12.5.4, Figure 12.45, WGIII Table SPM.1, Table 6.3}",./images/1233.png
1236,ar4_wg3_full_report-1.pdf,"Figure 9.14: Annual economic mitigation potential in the forestry sector by world 
region and cost class in 2030. ",./images/1236.png
1237,WGIII_TAR_full_report.pdf,Figure 3.10: Passenger car fuel economy cost curves.,./images/1237.png
1245,2007 The Physical Science Basis.pdf,"Figure 5.12. Changes in oxygen concentration (μmol kg–1) along two sections in the North Pacifi c (see map, bottom panel). Top left panel: Difference (1999 minus 1985)
along 47°N. Top right panel: Difference (1997 minus 1984) at 152°W. Blue colours indicate a decrease and yellow colours indicate an increase in oxygen over time. The differences were calculated using density as the vertical coordinate. After Deutsch et al. (2005).",./images/1245.png
1246,WGI_TAR_full_report.pdf,"Figure 11.7: Time-series of relative sea level for the past 300 years from Northern Europe: Amsterdam, Netherlands; Brest, France; Sheerness,
UK; Stockholm, Sweden (detrended over the period 1774 to 1873 to remove to first order the contribution of postglacial rebound);
Swinoujscie, Poland (formerly Swinemunde, Germany); and Liverpool, UK. Data for the latter are of 'Adjusted Mean High Water' rather than
Mean Sea Level and include a nodal (18.6 year) term. The scale bar indicates +-100 mm. (Adapted from Woodworth, 1999a.)",./images/1246.png
1248,ar4_wg3_full_report-1.pdf,"Figure 10.8: Global CH4 emissions from landfills in baseline scenario compared 
to the following mitigation scenarios: increased incineration, CDM ending by 2012 
(end of the first Kyoto commitment period), increased recycling, and high landfill CH4 
recovery rates including continuation of CDM after 2012 (Monni et al., 2006). The 
emission reductions estimated in the mitigation scenarios are largely additional to 
2050. This figure also includes the US EPA (2006) baseline scenario for landfill CH4 
emissions from Delhotal et al. (2006).",./images/1248.png
1249,Fourth National Climate Assessment  Volume I.pdf,"Figure 12.4: (a) Global mean sea level (GMSL) rise from 1800 to 2100, based on Figure 12.2b from 1800 to 2015, the 
six Interagency71 GMSL scenarios (navy blue, royal blue, cyan, green, orange, and red curves), the very likely ranges 
in 2100 for different RCPs (colored boxes), and lines augmenting the very likely ranges by the difference between the 
median Antarctic contribution of Kopp et al.76 and the various median Antarctic projections of DeConto and Pollard.77 
(b) Relative sea level (RSL) rise (feet) in 2100 projected for the Interagency Intermediate Scenario (1-meter [3.3 feet] 
GMSL rise by 2100) (Figure source: Sweet et al. 201771).",./images/1249.png
1251,Fourth National Climate Assessment  Volume I.pdf,"Figure 7.8: Projected change (percentage change relative to the 1976-2005 reference period average) in the number 
of daily zero ('No-Precip') and non-zero precipitation days (by percentile bins) for late-21st century under a higher 
scenario (RCP8.5). The precipitation percentile bin thresholds are based on daily non-zero precipitation amounts from 
the 1976-2005 reference period that have been ranked from low to high. These results are calculated from the LOCA 
downscaled data. (Figure source: CICS-NC and NOAA NCEI).",./images/1251.png
1256,WGI_TAR_full_report.pdf,"Figure 2.14: Monthly Arctic sea-ice extent anomalies, 1973 to 2000,
relative to 1973 to 1996. The data are a blend of updated Walsh (Walsh,
1978), Goddard Space Flight Center satellite passive microwave
(Scanning Multichannel Microwave Radiometer (SMMR) and Special
Sensor Microwave/Imager (SSM/I)) derived data (Cavalieri et al.,
1997) and National Centers for Environmental Prediction satellite
passive microwave derived data (Grumbine, 1996). Updated digitised
ice data for the Great Lakes are also included (Assel, 1983).",./images/1256.png
1259,ABCE_Kenya_finalreport_Jan2015.pdf,"Figure 22 Levels of medical expenses incurred by patients not seeking HIV services, by platform 
ownership, 2012 ",./images/1259.png
1261,2007 The Physical Science Basis.pdf,"Figure 8.14. Comparison of GCM climate feedback parameters for water vapour 
(WV), cloud (C), surface albedo (A), lapse rate (LR) and the combined water vapour 
plus lapse rate (WV + LR) in units of W m-2 degC-1. 'ALL' represents the sum of all feed-
backs. Results are taken from Colman (2003a; blue, black), Soden and Held (2006; 
red) and Winton (2006a; green). Closed blue and open black symbols from Colman 
(2003a) represent calculations determined using the partial radiative perturbation 
(PRP) and the radiative-convective method (RCM) approaches respectively. Crosses 
represent the water vapour feedback computed for each model from Soden and Held 
(2006) assuming no change in relative humidity. Vertical bars depict the estimated 
uncertainty in the calculation of the feedbacks from Soden and Held (2006).",./images/1261.png
1265,ABCE_Ghana_finalreport_Jan2015.pdf,"Figure 28 Range of efficiency scores, by platform, 2007-2011",./images/1265.png
1266,Climate Change 2001 Synthesis Report.pdf,"Figure 6-1: Stabilizing CO2 concentrations would require substantial reductions of emissions below
current levels and would slow the rate of warming.
a)",./images/1266.png
1271,WGIIAR5-PartA_FINAL.pdf,"Figure 7-8 | Simulated yield benefit from adaptation calculated as the difference
between the yield change from baseline (%) for paired non-adapted and adapted
cases as affected by temperature and aggregated across all crops. The shaded bands
at the 95% confidence interval are calculated as for Figure 7-4. Data points (N = 31)
where assessed benefit of management changes are negative are not included as
farmers are unlikely to intentionally adopt these. Data sources are the same as for
Table 7-2 and only studies that examine both a “no adaptation” and an “adaptation”
scenario are used so as to avoid the issues arising from unpaired studies documented
in Figure 7-4 for tropical maize.",./images/1271.png
1273,2007 The Physical Science Basis.pdf,"Figure 5.14. Variations in global mean sea level (difference to the mean 1993 to 
mid-2001) computed from satellite altimetry from January 1993 to October 2005, 
averaged over 65degS to 65degN. Dots are 10-day estimates (from the TOPEX/Posei-
don satellite in red and from the Jason satellite in green). The blue solid curve 
corresponds to 60-day smoothing. Updated from Cazenave and Nerem (2004) and 
Leuliette et al. (2004). ",./images/1273.png
1277,SRREN_Full_Report-1.pdf,"Figure 7.24 | Global primary energy supply of wind energy in long-term scenarios 
(median, 25th to 75th percentile range, and full range of scenario results; colour coding is 
based on categories of atmospheric CO2 concentration level in 2100; the specifi c number 
of scenarios underlying the fi gure is indicated in the right upper corner) (adapted from 
Krey and Clarke, 2011; see also Chapter 10).",./images/1277.png
1278,2007 The Physical Science Basis.pdf,"Figure 5.17. Overlapping 10-year rates of global sea level change from tide gauge
data sets (Holgate and Woodworth, 2004, in solid black; Church and White, 2006, in
dashed black) and satellite altimetry (updated from Cazenave and Nerem, 2004, in
green), and contributions to global sea level change from thermal expansion (Ishii et
al., 2006, in solid red; Antonov et al., 2005, in dashed red) and climate-driven land
water storage (Ngo-Duc et al., 2005, in blue). Each rate is plotted against the middle
of its 10-year period.",./images/1278.png
1282,Climate Change 2007 - Synthesis Report.pdf,"Figure 2.4. Global average radiative forcing (RF) in 2005 (best estimates and 5 to 95% uncertainty ranges) with respect to 1750 for CO2, CH4, N2O and other
important agents and mechanisms, together with the typical geographical extent (spatial scale) of the forcing and the assessed level of scientific understand-
ing (LOSU). Aerosols from explosive volcanic eruptions contribute an additional episodic cooling term for a few years following an eruption. The range for
linear contrails does not include other possible effects of aviation on cloudiness. {WGI Figure SPM.2}",./images/1282.png
1284,2007 The Physical Science Basis.pdf,"Figure 6.9. Timing and intensity of maximum temperature deviation from pre-industrial levels, as a function of latitude (vertical axis) and time (horizontal axis, in thousands of 
years before present ). Temperatures above pre-industrial levels by 0.5degC to 2degC appear in orange (above 2degC in red). Temperatures below pre-industrial levels by 0.5degC to 2degC 
appear in blue. References for data sets are: Barents Sea (Duplessy et al., 2001), Greenland (Johnsen et al., 2001), Europe (Davis et al., 2003), northwest and northeast America 
(MacDonald et al., 2000; Kaufman et al., 2004), China (He et al., 2004), tropical oceans (Rimbu et al., 2004; Stott et al., 2004; Lorentz et al., 2006), north Atlantic (Marchal et al., 
2002; Kim et al., 2004), Tasmania (Xia et al., 2001), East Antarctica (Masson et al., 2000), southern Africa (Holmgren et al., 2003) and New Zealand (Williams et al., 2004).",./images/1284.png
1285,2007 The Physical Science Basis.pdf,"Figure 5.1. Time series of global annual ocean heat content (1022 J) for the 0 to 700 m layer. The black curve is updated from Levitus et al. (2005a), with the shading repre-
senting the 90% confi dence interval. The red and green curves are updates of the analyses by Ishii et al. (2006) and Willis et al. (2004, over 0 to 750 m) respectively, with the er-
ror bars denoting the 90% confi dence interval. The black and red curves denote the deviation from the 1961 to 1990 average and the shorter green curve denotes the deviation 
from the average of the black curve for the period 1993 to 2003. ",./images/1285.png
1291,CARBON DIOXIDE CAPTURE AND STORAGE.pdf,"Figure 6.6 Observed variation in open ocean pH for the 1990s (shown on the total hydrogen scale; data from Key et al., 2004). In this figure the 
oceans are separated into separate panels. The three panels are on the same scale and coloured by latitude band to illustrate the large north-south 
changes in the pH of intermediate waters. Pre-industrial surface values would have been about 0.1 pH units greater than in the 1990s.",./images/1291.png
1292,WGI_TAR_full_report.pdf,"Figure 8.22: Nino-3 SST anomaly predictions and hindcast made at
various times during the 1997 to 1998 El Nino event together with the
subsequent observed SST anomaly (solid). Predictions made at
ECMWF (Stockdale et al., 1998, long dash), JMA (Ishii et al., 1998,
short dash), NCEP (Barnston et al., 1999, long short dash) and the
hindcast made at BMRC (Wang et al., 2000, dot dash) are shown.",./images/1292.png
1292,WGI_TAR_full_report.pdf,"Figure 8.22: Niño-3 SST anomaly predictions and hindcast made at
various times during the 1997 to 1998 El Niño event together with the
subsequent observed SST anomaly (solid). Predictions made at
ECMWF (Stockdale et al., 1998, long dash), JMA (Ishii et al., 1998,
short dash), NCEP (Barnston et al., 1999, long short dash) and the
hindcast made at BMRC (Wang et al., 2000, dot dash) are shown.",./images/1292.png
1294,2007 The Physical Science Basis.pdf,"Figure 9.10. Observed and hindcast decadal mean surface temperature anomalies (degC) expressed, for each decade, relative to the preceding three decades. Observed 
anomalies are represented by horizontal black lines. Hindcast decadal anomalies and their uncertainties (5 to 95% confi dence bounds) are displayed as vertical bars. Hindcasts 
are based on a Bayesian detection analysis using the estimated response to historical external forcing. Hindcasts made with CGCM2, HadCM2 (see Table 8.1 of the TAR) and 
HadCM3 (see Table 8.1, this report) use the estimated response to anthropogenic forcing only (left hand column of legend) while those made with selected MMD 20C3M 
models used anthropogenic and natural forcings (centre column of legend; see Table 8.1 for model descriptions). Hindcasts made with the ensemble mean of the selected 
20C3M models are indicated by the thick green line. A hindcast based on persisting anomalies from the previous decade is also shown. The hindcasts agree well with 
observations from the 1950s onward. Hindcasts for the decades of the 1930s and 1940s are sensitive to the details of the hindcast procedure. A forecast for the decadal global 
mean anomaly for the decade 2000 to 2009, relative to the 1970 to 1999 climatology, based on simulations performed with the Canadian Centre for Climate Modelling and 
Analysis Coupled Global Climate Model (CGCM2) is also displayed. From Lee et al. (2006).",./images/1294.png
1295,2007 The Physical Science Basis.pdf,"Figure 5.19. Global sea level change due to thermal expansion for 1955 to 2003, based on Levi-
tus et al. (2005a; black line) and Ishii et al. (2006; red line) for the 0 to 700 m layer, and based on 
Willis et al. (2004; green line) for the upper 750 m. The shaded area and the vertical red and green 
error bars represent the 90% confi dence interval. The black and red curves denote the deviation 
from their 1961 to 1990 average, the shorter green curve the deviation from the average of the 
black curve for the period 1993 to 2003.",./images/1295.png
1296,SRREN_Full_Report-1.pdf,"Figure 10.33 | Schematic representation of experience curves, deployment costs and 
learning investments (modifi ed version of the diagram depicted in IEA, 2008b, p. 204).",./images/1296.png
1301,SR15_Chapter_2_LR.pdf,"Figure 2.10 | Accounting of cumulative CO2 emissions for the four 1.5degC-consistent pathway archetypes. See top panel for explanation of the bar plots. Total 
CDR is the difference between gross (red horizontal bar) and net (purple horizontal bar) cumulative CO2 emissions over the period 2018-2100, and it is equal to the sum of the 
BECCS (grey) and AFOLU CDR (green) contributions. Cumulative net negative emissions are the difference between peak (orange horizontal bar) and net (purple) cumulative CO2 
emissions. The blue shaded area depicts the estimated range of the remaining carbon budget for a two-in-three to one-in-two chance of staying below1.5degC. The grey shaded 
area depicts the range when accounting for additional Earth system feedbacks. ",./images/1301.png
1302,SRREN_Full_Report-1.pdf,"Figure 10.3 | Historic global total primary energy supply (direct equivalent) and projec-
tions from 164 long-term scenarios. Colour coding is based on categories of atmospheric 
CO2 concentration level in 2100 (Fisher et al., 2007), with historic data from Grubler 
(2008). Figure and data adapted from Krey and Clarke (2011), modifi ed to include two 
additional scenarios.",./images/1302.png
1303,ar4_wg3_full_report-1.pdf,"Figure 5.19: Co-benefits from different mitigation measures in Santiago de Chile
Note: toll is applied for cars/busses to enter downtown area or inside the 
Americo Vespucio ring around the city.",./images/1303.png
1304,SRREN_Full_Report-1.pdf,"Figure 11.7 | Germany's electricity generation from RE, 1990 to 2009 (BMU, 2010).",./images/1304.png
1307,SRREN_Full_Report-1.pdf,"Figure 10.1 | Historic global fossil and industrial CO2 emissions and projections from 
164 long-term scenarios. Colour coding is based on categories of atmospheric CO2 con-
centration in 2100 as defi ned in the IPCC AR4, WGIII (Fisher et al., 2007), with historic 
emission data from Nakicenovic et al. (2006). Figure and data adapted from Krey and 
Clarke (2011), modifi ed to include two additional scenarios.",./images/1307.png
1309,WGI_TAR_full_report.pdf,"Figure 12.2: Coloured lines: power spectra of global mean temperatures in the unforced control integrations that are used to provide estimates of
internal climate variability in Figure 12.12. All series were linearly detrended prior to analysis, and spectra computed using a standard Tukey
window with the window width (maximum lag used in the estimate) set to one-fifth of the series length, giving each spectral estimate the same
uncertainty range, as shown (see, e.g., Priestley, 1981). The first 300 years were omitted from ECHAM3-LSG, CGCM1 and CGCM2 models as
potentially trend-contaminated. Solid black line: spectrum of observed global mean temperatures (Jones et al., 2001) over the period 1861 to 1998
after removing a best-fit linear trend. This estimate is unreliable on inter-decadal time-scales because of the likely impact of external forcing on
the observed series and the negative bias introduced by the detrending. Dotted black line: spectrum of observed global mean temperatures after
removing an independent estimate of the externally forced response provided by the ensemble mean of a coupled model simulation (Stott et al.,
2000b, and Figure 12.7c). This estimate will be contaminated by uncertainty in the model-simulated forced response, together with observation
noise and sampling error. However, unlike the detrending procedure, all of these introduce a positive (upward) bias in the resulting estimate of the
observed spectrum. The dotted line therefore provides a conservative (high) estimate of observed internal variability at all frequencies. Asterisks
indicate models whose variability is significantly less than observed variability on 10 to 60 year time-scales after removing either a best-fit linear
trend or an independent estimate of the forced response from the observed series. Significance is based on an F-test on the ratio observed/model
mean power over this frequency interval and quoted at the 5% level. Power spectral density (PSD) is defined such that unit-variance uncorrelated
noise would have an expected PSD of unity (see Allen et al., 2000a, for details). Note that different normalisation conventions can lead to different
values, which appear as a constant offset up or down on the logarithmic vertical scale used here. Differences between the spectra shown here and
the corresponding figure in Stouffer et al. (2000) shown in Chapter 8, Figure 8.18 are due to the use here of a longer (1861 to 2000) observational
record, as opposed to 1881 to 1991 in Figure 8.18. That figure also shows 2.5 to 97.5% uncertainty ranges, while for consistency with other
figures in this chapter, the 5 to 95% range is displayed here.",./images/1309.png
1312,ar4_wg3_full_report-1.pdf,"Figure 3.10: Baseline land-use change and forestry carbon net emissions.
Notes: MESSAGE-EMF21 = Rao and Riahi (2006) scenario from EMF-21 
Study; GTEM-EMF21 = Jakeman and Fisher (2006) scenario from EMF-21 
Study; MESSAGE-A2r = Riahi et al. (2006) scenario with revised SRES-A2 
baseline; IMAGE 2.3 = Van Vuuren et al. (2007) scenario; see Figure 3.7 notes 
for additional scenario references. The IMAGE 2.3 LUCF baseline scenario also 
emits non-CO2 emissions (CH4 and N2O) of 0.26, 0.30, 0.16 GtCO2-eq in 2030, 
2050, and 2100, respectively.",./images/1312.png
1317,ar4_wg3_full_report-1.pdf,"Figure 4: Percentage of ART sites that reported a stock out of ARVs, 2017-2018 ",./images/1317.png
1317,ar4_wg3_full_report-1.pdf,"Figure 3.16: Relationship of total radiative forcing vis-à-vis CO2 concentration
for the year 2100 (25 multi-gas stabilization scenarios for alternative stabilization
targets).",./images/1317.png
1318,ar4_wg3_full_report-1.pdf,"Figure 3.16: Relationship of total radiative forcing vis-a-vis CO2 concentration 
for the year 2100 (25 multi-gas stabilization scenarios for alternative stabilization 
targets).",./images/1318.png
1324,Tracking Universal Health Coverage 2017.pdf,"Fig. 1.8. Percentage of mother-child pairs covered with three or fewer basic health services out of seven by within-country 
wealth quintilea",./images/1324.png
1326,https://drive.google.com/file/d/10nPf3bjcz_4JhMjpFH1iUF29QkW8s5Yl/view?usp=drive_link,"Figure 5.2 | Synergies and trade-offs and gross Sustainable Development Goal (SDG)-interaction with individual mitigation options. The top three wheels represent synergies 
and the bottom three wheels show trade-offs. The colours on the border of the wheels correspond to the SDGs listed above, starting at the 9 o'clock position, with reading 
guidance in the top-left corner with the quarter circle (Note 1). Mitigation (climate action, SDG 13) is at the centre of the circle. The coloured segments inside the circles can be 
counted to arrive at the number of synergies (green) and trade-offs (red). The length of the coloured segments shows the strength of the synergies or trade-offs (Note 3) and 
the shading indicates confidence (Note 2). Various mitigation options within the energy demand sector, energy supply sector, and land and ocean sector, and how to read them 
within a segment are shown in grey (Note 4). See also Table 5.2.",./images/1326.png
1333,SR15_Chapter_2_LR.pdf,"Figure 2.23 | Comparison of (a) final energy, (b) direct CO2 emissions, (c) carbon intensity, (d) electricity and biofuel consumption in the transport sector 
between IAM and sectoral studies. The squares and circles indicate the IAM archetype pathways and diamonds the data of sectoral scenarios. The red dotted line indicates the 
2010 level. H2DS = Higher-2degC, L2DS = Lower-2degC, 1.5DS-H = 1.5degC-high-OS, 1.5DS-L = 1.5degC-low-OS. The label 1.5DS combines both high and low overshoot 1.5degC-consistent 
pathways. Section 2.1 for descriptions.",./images/1333.png
1337,WGI_TAR_full_report.pdf,"Figure 2.34: An example (from Groisman et al., 1999) of the
sensitivity of the frequency of heavy daily rainfall to a shift in the
mean total rainfall, based on station data from Guangzhou, China. This
example uses a threshold of 50 mm of precipitation per day. It shows
the effects of a 10% increase and a 10% decrease in mean total
summer rainfall, based on a gamma distribution of the rainfall with a
constant shape parameter.",./images/1337.png
1353,Climate Change 2001 Synthesis Report.pdf,"Figure 2-7: The economic losses from catastrophic weather events have risen globally 10-fold (inflation-
adjusted) from the 1950s to the 1990s, much faster than can be accounted for with simple inflation. The
insured portion of these losses rose from a negligible level to about 23% in the 1990s. The total losses from small, non-catastrophic weather-
related events (not included here) are similar. Part of this observed upward trend in weather-related disaster losses over the past 50 years is
linked to socio-economic factors (e.g., population growth, increased wealth, urbanization in vulnerable areas), and part is linked to regional
climatic factors (e.g., changes in precipitation, flooding events).",./images/1353.png
1388,CARBON DIOXIDE CAPTURE AND STORAGE.pdf,"Figure 6.3 Equilibrium partitioning of CO2 between the ocean and 
atmosphere. On the time scale of millennia, complete mixing of the 
oceans leads to a partitioning of cumulative CO2 emissions between the 
oceans and atmosphere with the bulk of emissions eventually residing in 
the oceans as dissolved inorganic carbon. The ocean partition depends 
nonlinearly on CO2 concentration according to carbonate chemical 
equilibrium (Box 6.1) and has limited sensitivity to changes in surface 
water temperature (shown by the grey area for a range of climate 
sensitivity of 1.5 to 4.5degC for CO2 doubling) (adapted from Kheshgi 
et al., 2005; Kheshgi, 2004a). pH evaluated from pCO2 of 275 ppm. 
This calculation is relevant on the time scale of several centuries, and 
does not consider changes in ocean alkalinity that increase ocean CO2 
uptake over several millennia (Archer et al., 1997).",./images/1388.png
1395,SRREN_Full_Report-1.pdf,"Figure 3.17 | Solar price experience or learning curve for silicon PV modules. Data dis-
played follow the supply and demand fl uctuations. Data source: Maycock (1976-2003); 
Bloomberg (2010).",./images/1395.png
1396,CARBON DIOXIDE CAPTURE AND STORAGE.pdf,"Figure 6.2 Simulated atmospheric CO2 resulting from CO2 release to 
the atmosphere or injection into the ocean at 3,000 m depth (Kheshgi 
and Archer, 2004). Emissions follow a logistic trajectory with 
cumulative emissions of 18,000 GtCO2. Illustrative cases include 
100% of emissions released to the atmosphere leading to a peak in 
concentration, 100% of emissions injected into the ocean, and no 
emissions (i.e., other mitigation approaches are used). Additional 
cases include atmospheric emission to year 2050, followed by either 
50% to atmosphere and 50% to ocean after 2050 or 50% to atmosphere 
and 50% by other mitigation approaches after 2050. Ocean injection 
results in lower peak concentrations than atmospheric release but 
higher than if other mitigation approaches are used (e.g., renewables 
or permanent storage).",./images/1396.png
